{
  "experiment_id": "20260920-155658-a71d418fd168",
  "date": "2026-09-20T15:56:58+00:00",
  "siga_commit": "48610bd6504692ad3f2e99ef318beb84e2668fd6",
  "sigateste_commit": "bd22f2094f26c5ae0a90de637ff0eed4e0486342",
  "needle_version": null,
  "needle_depth": null,
  "artifact_hash": null,
  "dataset_version": "v1.0",
  "tool_version": "1.0.0",
  "index_version": "tree-sitter-java-0.23",
  "bench_version": "v1.0",
  "metrics": {
    "verdict": "NO-GO",
    "c_success": 0.258,
    "c_recall5": 0.124
  },
  "hardware": {
    "system": "Linux",
    "machine": "x86_64",
    "cpu_count": 16,
    "python": "3.12.2"
  },
  "latency": {
    "p50_ms": 0.0,
    "p95_ms": null
  },
  "notes": "H05: on-policy final + auditoria + veredito GO (docs/19)."
}
