{
  "experiment_id": "20260920-163512-9c79426d408c",
  "date": "2026-09-20T16:35:12+00:00",
  "siga_commit": "48610bd6504692ad3f2e99ef318beb84e2668fd6",
  "sigateste_commit": "66f2998127b17828f01057ff1f7a13cc518f913d",
  "needle_version": null,
  "needle_depth": null,
  "artifact_hash": null,
  "dataset_version": "v1.0",
  "tool_version": "1.0.0",
  "index_version": "tree-sitter-java-0.23",
  "bench_version": "v1.0",
  "metrics": {
    "n_run_files": 1,
    "n_tasks_scored": 120,
    "n_tasks_arm_A": 60,
    "n_tasks_arm_B": 60,
    "comparisons": [
      {
        "comparable": true,
        "task_success_delta": -0.217,
        "effective_token_reduction": -2.81,
        "verdict": "mcp_hurts"
      }
    ]
  },
  "hardware": {
    "system": "Linux",
    "machine": "x86_64",
    "cpu_count": 16,
    "python": "3.12.2"
  },
  "latency": {
    "p50_ms": 0.0,
    "p95_ms": null
  },
  "notes": "G03: veredito A vs B da suite EVAL-MCP (docs/18)."
}
