{
  "experiment_id": "20260918-160026-300752dee6d6",
  "date": "2026-09-18T16:00:26+00:00",
  "siga_commit": "48610bd6504692ad3f2e99ef318beb84e2668fd6",
  "sigateste_commit": "aeeaa9ad0fb1db9b651074702084a3d623cd0f90",
  "needle_version": "2.0-45M",
  "needle_depth": 12,
  "artifact_hash": null,
  "dataset_version": "v1.0",
  "tool_version": "1.0.0",
  "index_version": "1.0.0",
  "bench_version": "1.0.0",
  "metrics": {
    "base_tool_acc": 0.9346,
    "tuned_best_tool_acc": 0.9969,
    "gain_accuracy": 0.0623,
    "gain_no_tool": 0.0312,
    "tuned_best_success": 0.9969
  },
  "hardware": {
    "system": "Linux",
    "machine": "x86_64",
    "cpu_count": 16,
    "python": "3.12.2"
  },
  "latency": {
    "p50_ms": 0.02,
    "p95_ms": 0.04
  },
  "notes": "P07-T02: LoRA progression 100->500->2k->5k->10k com error analysis escrita e matriz de profundidade (depth 2..20). Ganho comprovado."
}
