{
  "experiment_id": "20260920-160452-a9ed9adbc530",
  "date": "2026-09-20T16:04:52+00:00",
  "siga_commit": "48610bd6504692ad3f2e99ef318beb84e2668fd6",
  "sigateste_commit": "13b510cda5ecc4442142c6cb3fa77357b3087b96",
  "needle_version": null,
  "needle_depth": null,
  "artifact_hash": null,
  "dataset_version": "v1.0",
  "tool_version": "1.0.0",
  "index_version": "tree-sitter-java-0.23",
  "bench_version": "v1.0",
  "metrics": {
    "n_train": 6,
    "n_val": 23,
    "ready": false
  },
  "hardware": {
    "system": "Linux",
    "machine": "x86_64",
    "cpu_count": 16,
    "python": "3.12.2"
  },
  "latency": {
    "p50_ms": 0.0,
    "p95_ms": null
  },
  "notes": "H06: gold agentivo em formato de treino + readiness (docs/19)."
}
