{
  "experiment_id": "20260919-014232-8429b35725d9",
  "date": "2026-09-19T01:42:32+00:00",
  "siga_commit": "48610bd6504692ad3f2e99ef318beb84e2668fd6",
  "sigateste_commit": "273a254b1d160d6dbaf6f37dc0f8a6f96c99e8d4",
  "needle_version": "needle-tuned-5000-d12",
  "needle_depth": null,
  "artifact_hash": null,
  "dataset_version": "v1.0",
  "tool_version": "1.0.0",
  "index_version": "1.0.0",
  "bench_version": "1.0.0",
  "metrics": {
    "tuned_task_success_test": 0.9718,
    "rules_task_success_test": 0.9577,
    "delta_tuned_minus_rules_test": 0.0141,
    "triggered_current": 0.0
  },
  "hardware": {
    "system": "Linux",
    "machine": "x86_64",
    "cpu_count": 16,
    "python": "3.12.2"
  },
  "latency": {
    "p50_ms": 0.0,
    "p95_ms": null
  },
  "notes": "F13: monitor do gatilho ADR-009 por janela temporal no holdout congelado; mesmo harness/régua do P07 nos dois lados (docs/15 §6)."
}
