{
  "experiment_id": "20260920-152428-796cb9682cd2",
  "date": "2026-09-20T15:24:28+00:00",
  "siga_commit": "48610bd6504692ad3f2e99ef318beb84e2668fd6",
  "sigateste_commit": "9594d1cc5339c6130338334eb1cbd8870a984910",
  "needle_version": null,
  "needle_depth": null,
  "artifact_hash": null,
  "dataset_version": "v1.0",
  "tool_version": "1.0.0",
  "index_version": "tree-sitter-java-0.23",
  "bench_version": "v1.0",
  "metrics": {
    "b_fail": 31,
    "b_modes": {
      "no_files_cited": 0,
      "out_of_head": 4,
      "history_commit_miss": 0,
      "wrong_module": 8,
      "partial_miss": 19
    }
  },
  "hardware": {
    "system": "Linux",
    "machine": "x86_64",
    "cpu_count": 16,
    "python": "3.12.2"
  },
  "latency": {
    "p50_ms": 0.0,
    "p95_ms": null
  },
  "notes": "H01: failure mining da ref1 EVAL-MCP (docs/19)."
}
