{
  "experiment_id": "20260918-185248-277bcaa6ef0c",
  "date": "2026-09-18T18:52:48+00:00",
  "siga_commit": "48610bd6504692ad3f2e99ef318beb84e2668fd6",
  "sigateste_commit": "1c8357806b4a22132dd26392f5fb3f7fd7d02a33",
  "needle_version": "2.0-45M-subnetwork-12L-onpolicy",
  "needle_depth": 12,
  "artifact_hash": null,
  "dataset_version": "holdout-v1",
  "tool_version": "siga-audit-v1",
  "index_version": "tree-sitter-java-0.23",
  "bench_version": "siga-bench-v1",
  "metrics": {
    "holdout_tasks": 311,
    "unmeasured_baselines": 2,
    "missing_reports": 0,
    "recommendation": "GO condicional"
  },
  "hardware": {
    "system": "Linux",
    "machine": "x86_64",
    "cpu_count": 16,
    "python": "3.12.2"
  },
  "latency": {
    "p50_ms": 0.0,
    "p95_ms": null
  },
  "notes": "P11-T02: auditoria final do vertical slice + release candidate local."
}
