{
  "experiment_id": "20260919-142045-1788b4e26166",
  "date": "2026-09-19T14:20:45+00:00",
  "siga_commit": "48610bd6504692ad3f2e99ef318beb84e2668fd6",
  "sigateste_commit": "c6d4930d7acadfebd86f260c2230640143efb53b",
  "needle_version": null,
  "needle_depth": null,
  "artifact_hash": null,
  "dataset_version": "v1.0",
  "tool_version": "1.0.0",
  "index_version": "1.0.0",
  "bench_version": "1.0.0",
  "metrics": {
    "verdict": "keep_4bit",
    "ram_candidate_4bit_mb": 28.6,
    "ram_candidate_2bit_mb": 15.4,
    "session_ram_mb": 22.53,
    "simulated_parity": true
  },
  "hardware": {
    "system": "Linux",
    "machine": "x86_64",
    "cpu_count": 16,
    "python": "3.12.2"
  },
  "latency": {
    "p50_ms": 0.0,
    "p95_ms": null
  },
  "notes": "F19: decisão 2-bit vs 4-bit com números (P08 congelado + F16 medido); gatilhos de revisitação registrados."
}
